title,date,main,url,section,section_name
"트럼프 캠프 ""해리스 상승세, 정지된 현실…허니문 곧 끝날 것""",2024.08.09. 오후 1:45,"""언론, 해리스에 긍정적…가짜뉴스는 국민의 적""도널드 트럼프 전 미국 대통령이 8일 (현지시간) 플로리다주 팜 비치에 있는 마러라고 별장에서 가진 기자회견을 하고 있다. 2024.08.09 ⓒ AFP=뉴스1 ⓒ News1 우동명 기자(서울=뉴스1) 김예슬 기자 = 도널드 트럼프 전 미국 대통령 측에서 카멀라 해리스 부통령의 최근 상승세에 대해 ""정지된 현실(suspended reality)""이라고 표현하며 그가 상승세를 유지할 수 없을 것이라고 주장했다.8일(현지시간) 외신을 종합하면 트럼프 전 대통령은 이날 플로리다주(州)에 있는 개인 소유 마러라고 리조트에서 단독 기자회견을 열었다.트럼프 전 대통령의 수석 고문인 여론 조사 전문가 토니 파브리지오는 ""우리는 몇 주 동안 현실을 정지시킨 일종의 유체이탈을 경험하고 있다""고 말했다.이어 ""그 정지된 현실 속에서 카멀라 해리스는 조 바이든을 만난 적이 없는 것 같다""며 ""해리스는 바이든 행정부에서 일어난 일에 대해 아무런 책임이 없는 것처럼 행동하기 위해 노력할 것""이라고 덧붙였다.또 이날 트럼프 캠프 관계자들은 기자들에게 해리스 부통령과 관련된 기사 제목이 적힌 8페이지 분량의 문서를 나눠주기도 했다. 기사 제목들이 해리스 부통령에게 지나치게 호의적이라는 취지에서다.트럼프 전 대통령은 기자회견에 앞서 자신의 소셜미디어 트루스소셜에 ""카멀라의 집회에 1000명이 모이면 언론은 미쳐서 그것이 얼마나 큰 규모인지 떠들 것""이라며 ""가짜뉴스는 국민의 적""이라고 적었다.트럼프 캠프 내부에서는 해리스 부통령에 대한 긍정적인 언론 보도에도 불구하고 그의 상승세가 곧 꺾일 것으로 보고 있다. 트럼프 전 대통령의 측근은 폴리티코에 ""트럼프 캠프는 해리스의 허니문이 곧 끝날 것이라고 여전히 확신하고 있다""며 ""우리는 그것이 며칠 내 사라질 것이라고 기대한다""고 강조했다.트럼프 전 대통령은 최근 여론조사에서 해리스 부통령에게 근소하게 밀리고 있다. 입소스가 지난 2~7일 전국 유권자를 상대로 한 여론조사에서 해리스 부통령의 지지율은 42%, 트럼프 전 대통령(37%)을 앞섰다.또 미국 정치 전문 매체 더힐에 따르면 지난 4~6일 사이 등록 유권자를 대상으로 실시된 여론조사에서도 해리스 부통령은 45% 대 43%로 트럼프 전 대통령을 2%p 차이로 앞섰다. 그 전주에는 해리스 부통령은 같은 여론조사에서 46% 대 44%로 트럼프 전 대통령을 2%p 차이로 앞선 바 있다.",https://n.news.naver.com/mnews/article/421/0007720990,104,세계
"중국, 이제 내연차보다 전기차 더 산다…'점유율 50%' 첫 돌파",2024.08.09. 오후 3:04,"중국의 전기차 판매가 처음으로 내연차를 넘어섰다. 중국에서 전기차가 대세로 부상하면서 미국보다 한 발 앞서 전동화 추세를 주도할 가능성이 엿보인다.[베이징(중국)=뉴시스] 박정규 기자 = 25일(현지시간) 중국 베이징 중국국제전람중심 순의관에서 열린 베이징 국제모터쇼 '오토차이나 2024'에 BYD 차량이 전시돼 있다. 2024.04.25.8일 중국 승용차시장정보연석회(CPCA)는 7월 중국 승용차 시장 판매대수가 172만대로 작년 동기 대비 2.8% 감소했다고 밝혔다. 이중 내연차 판매대수는 84만대로 지난해 동기 대비 26% 급감했으나, 전기차(친환경차) 판매대수는 87만8000대로 오히려 36.9% 급증했다. 전기차 점유율은 월간 기준 사상 처음으로 절반을 넘어서며 51.1%를 기록했다.중국 경제매체 차이신에 따르면 중국의 전기차 점유율은 2021~2023년 연간 기준 각 14.8%→27.6%→35.7%로 빠르게 상승했다. 중국 정부가 2025년 목표로 내세운 전기차 점유율 20%도 3년 빠른 2022년에 달성됐다. 중국에서 말하는 전기차는 순수전기차인 BEV를 비롯해 플러그인하이브리드차(PHEV), 수소연료전지차(FCEV)를 모두 포함한다.특히 플러그인하이브리드 인기가 급상승 중이다. 7월 중국 전기차 판매 중 순수전기차와 플러그인하이브리드 차 판매대수는 각 48만2000대와 39만6000대로 작년 대비 각각 14.3%, 80.4% 늘었다. CPCA는 ""중국 자동차 업체의 플러그인하이브리드 기술 혁신으로 중국 플러그인하이브리드 차 판매가 전 세계 시장의 78%를 차지했으며 이는 중국 승용차 시장의 전기차 점유율이 50%를 돌파한 주요 원인""이라고 분석했다.중국 승용차 시장의 전기차 점유율 추이/그래픽=윤선정중국에서 플러그인하이브리드 차는 가성비를 앞세워 올들어 선풍적인 인기를 누리고 있다. 특히 BYD는 지난해부터 '유전동가'(油電同價·내연기관차와 전기차 가격이 동일) 구호와 함께 저가 전기차를 출시하며 내연차 시장 공략에 나섰다. 올해 2월에는 '내연차보다 싼 전기차'를 내세우며 가격이 7만9800위안(약 1520만원)에 불과한 기존 모델의 '롱야오' 버전을 잇달아 출시했다. BYD는 상반기에만 전기차 160만7000대를 팔아 치웠으며 이중 플러그인하이브리드 차가 54.8%를 차지했다.한편 전동화 추세에 올라탄 중국 전기차업체들의 진격으로 BBA(벤츠·BMW·아우디) 등 고급차뿐 아니라 독일·일본 자동차업체의 점유율은 감소 추세를 벗어나지 못했다.7월 중국 승용차 시장에서 중국 로컬브랜드의 점유율은 작년 동기 대비 8.5%포인트 상승한 61.8%로 상승했다. 반면 글로벌 완성차 브랜드는 독일계 브랜드의 점유율이 17.6%(2.9%p↓), 일본계 브랜드는 12.9%(3%p↓), 미국계 브랜드는 5.8%(1.9%p↓)를 기록하는 등 하락 추세가 심화됐다.올들어 내연차 의존도가 높은 글로벌 완성차 브랜드는 중국에서 전동화 전환 지연, 판매량 감소, 가격인하, 감산, 해고 및 임금 삭감 소식으로 계속해서 언론 지면을 장식하고 있다.",https://n.news.naver.com/mnews/article/008/0005075231,104,세계
"美민주 해리스·월즈, 미시간서 유세…노동계 표심 공략",2024.08.09. 오전 7:12,"[6일(현지시간) 필라델피아 유세장에 참석한 해리스 부통령과 팀 월즈 미네소타 주지사. (필라델피아 EPA=연합뉴스)]미국 민주당 대선 후보인 카멀라 해리스 부통령과 러닝메이트 부통령 후보 팀 월즈 미네소타 주지사가 대선 경합주인 미시간주에서 유세에 나섰습니다.현지시간 8일 해리스 부통령과 월즈디트로이트에서 전미자동차노조(UAW) 조합원들을 대상으로 유세를 하고 89일 앞으로 다가온 대선에서 지지를 호소했습니다.미국의 대형 노조들은 전통적으로 민주당과 우호 관계를 형성해 왔습니다.올 11월 대선을 앞두고도 UAW를 비롯해 건설·전기 등 대형 노조들이 일찌감치 조 바이든 미국 대통령에 대한 지지를 선언하고 조직적으로 세를 집결해 왔습니다.하지만 바이든 대통령이 첫 TV 토론에서 참패하며 민주당 내부에서 심각한 위기론이 대두하면서 노조 지지세도 다소 주춤한 상황이었습니다.민주당의 정·부통령 후보로 결정된 해리스 부통령과 월즈 주지사가 경합주 유세의 일환으로 디트로이트를 서둘러 찾은 것 역시 이같이 흔들리는 지지 기반을 다잡기 위한 것으로 풀이됩니다.특히 러스트벨트(미 오대호 인근의 쇠락한 공업지대)에 속한 '블루월'(민주당이 대선에서 승리한 지역)이자 경합주인 미시간과 위스콘신주는 민주당이 반드시 사수해야 할 곳으로 노동자 표심이 선거승패를 좌우하는 것으로 꼽힙니다.숀 페인 UAW 위원장은 월즈 주지사의 부통령 후보 지명 이후 곧바로 지지 입장을 밝히고 이들을 '민주당의 다이나믹 듀오'로 칭하는 등 변함없는 지지를 재확인했으며 주요 노조 지도부 역시 이 같은 대열에 합류하고 있습니다.해리스 부통령은 유세에서 ""우리는 집단적 힘을 믿는다""면서 ""우리는 우리를 분열하고 갈라놓으려는 세력과 싸울 것""이라며 도널드 트럼프 전 대통령과 공화당을 분열 세력으로 규정했습니다.이어 ""UAW의 지지를 받게 돼 너무나 큰 영광이고 감사하다""면서 ""우리는 국민과 노동의 존엄, 자유, 정의, 평등을 대변하며 이 모든 것을 위해 싸워나갈 것""이라고 목소리를 높였습니다.월즈 주지사는 ""노조가 중산층을 만들었고, 다른 모든 미국인도 (이를) 알고 있다""며 ""이를 믿지 않는 사람이 도널드 트럼프""라고 트럼프 전 대통령을 직격했습니다. 그러면서 ""트럼프는 세계를 전적으로 우리와 다른 방식으로 바라본다""며 ""모든 공동체와 이웃, 노조가 세계를 통합의 관점으로 바라보지만 이 사람은 그렇게 보지 않는다. 그에게는 자신만이 중요하다""고도 비판했습니다.당신의 제보가 뉴스로 만들어집니다.SBS Biz는 여러분의 제보를 기다리고 있습니다.홈페이지 = https://url.kr/9pghjn",https://n.news.naver.com/mnews/article/374/0000396822,104,세계
"中 소비자 물가, 예상치 상회했지만… 디플레 우려는 여전",2024.08.09. 오후 12:43,"중국의 소비자물가(CPI) 상승률이 시장 예상치를 뛰어넘었다. 하지만 6개월째 0%대를 벗어나지 못하고 있는 데다, CPI의 선행 지표로 꼽히는 생산자물가(PPI) 상승률 역시 21개월째 마이너스를 기록하고 있어 디플레이션(경기 침체 속 물가 하락) 우려가 완전히 사라지기까지는 시일이 필요하다.중국 국가통계국은 7월 CPI가 전년 동기 대비 0.5% 상승했다고 9일 밝혔다. 전월(0.2%)보다 0.3%포인트 확대됐고, 블룸버그통신이 집계한 시장 예상치(0.3%)도 상회했다. 지난 2월(0.7%) 이후 가장 높은 수준이기도 하다.중국 월간 CPI 상승률은 지난해 9월 0.0%를 찍고 올해 1월 -0.8%까지 떨어졌다. 2월 반등했지만, 3월부터 6월까지 0.1~0.3% 수준을 유지했다. 7월도 절대적으로 높은 수치는 아닌 데다, 반년째 0%대를 벗어나지 못하고 있다는 점에서 저물가가 해소됐다고 보기는 어렵다.중국 소비자물가 상승률 추이. 파란 선이 전년 동기 대비, 노란 선이 전월 대비./중국 국가통계국 캡처둥리쥐안 국가통계국 수석통계학자는 이번 CPI 상승에 대해 “소비 수요의 지속적인 회복과 일부 지역의 고온, 높은 강수량 영향으로 식품 가격이 급등했다”라고 설명했다. 실제 돼지고기 가격이 1년 전 같은 기간보다 20.4% 상승한 것이 이번 CPI를 끌어올렸다. 중국에서 돼지고기 가격은 CPI에서 가장 큰 비중을 차지해 물가의 가늠자로 꼽힌다. 전 세계 돼지고기의 절반가량이 중국에서 생산되는 데다, 중국 육류 소비의 60%를 차지하기 때문이다.여기에 신선야채(3.3%)와 교통 연료(5.1%), 여행(3.1%) 가격이 오른 점도 CPI 상승에 기여했다. 단 소고기(-12.9%)와 식용유(-4.1%)·과일(-4.2%), 자동차(-5.6%) 가격은 떨어져 전체 CPI 상승세를 제한했다.CPI의 선행 지표 역할을 하는 PPI는 전년 동기 대비 0.8% 하락해 전월과 같은 수준을 유지했다. 시장이 0.9% 하락할 것으로 예상한 것을 고려하면 선방했다. 2016년 이후 최장 기간인 22개월 연속 하락세를 기록 중이지만, 지난해 7월 -4.4%를 기록한 이후 같은 해 11월 -3.0%, 올해 5월 -1.4% 등 조금씩 낙폭을 줄이고 있다.중국의 내수 회복 여부에 올해 경제성장률 목표(5% 안팎) 달성 여부가 달려있다는 분석이 나온다. 블룸버그는 “올해 중국 경제에서 보기 드물게 밝았던 수출이 7월 들어 예상치 못하게 둔화했고, 이는 올해 중국의 성장 목표를 위협하고 있다”라며 “국내 수요를 되살리는 것이 점점 더 중요해지고 있다”라고 했다.",https://n.news.naver.com/mnews/article/366/0001010904,104,세계
뱅크시 이례적 동물그림 릴레이 벽화에 '들썩'…다음 벽화 어디,2024.08.08. 오후 12:52,"뱅크시가 7일(현지시간) 런던 브릭 레인의 기차역 다리에 남긴 원숭이 벽화. EPA=연합뉴스이름 없는 그래피티 예술가 뱅크시가 영국 런던에서 잇달아 벽화를 공개하면서 현지에서는 다음 그림을 찾아내려는 기대감이 커지고 있다고 7일(현지시간) 영국 일간 가디언 등이 전했다.뱅크시는 그간 철저히 신분을 드러내지 않고 작품을 남겨왔기에 이처럼 매일같이 벽화를 그려놓는 것은 이례적이다.뱅크시는 이날 런던 동부의 구제 패션 거리인 브릭 레인에서 기차가 지나다니는 다리 벽면에 그네를 타는 원숭이 세 마리가 담긴 벽화를 남겼다.뱅크시는 이후 인스타그램 계정에 이 벽화가 자기 작품임을 인증했다.이같은 깜짝 등장에 런던 곳곳에서는 벽화 앞에 모인 사람들이 '인증샷'을 찍는 모습이 연출되고 있다.뱅크시가 6일(현지시간) 런던 첼시의 한 건물에 남긴 코끼리 벽화. EPA=연합뉴스뱅크시는 전날에도 첼시 에디스 테라스의 주거용 건물에 남긴 벽화는 건물 벽에 두 마리의 코끼리가 막힌 창문 밖으로 머리를 내밀고 있는 모습의 벽화를 남겼다.5일에는 런던 남서부 리치먼드의 큐 브릿지 인근 건물 벽에 염소 모습의 벽화를 남겼다. 이 작품은 바위가 아래로 떨어지는 난간 위에 그려진 염소의 실루엣과 이를 지켜보는 CCTV 카메라를 묘사하고 있다.더 타임스는 염소 벽화가 그려진 벽에 있는 진짜 CCTV가 작업자용 크레인을 이용해 벽화를 그리는 모습을 감추기 위해 들어 올려지는 장면이 CCTV 영상에 포착됐다면서 화면에 나온 두사람 중 한명이 뱅크시일 가능성이 있다고 전했다.뱅크시가 5일(현지시간) 영국 리치먼드의 큐 브릿지 인근 건물에 그린 염소 벽화. EPA=연합뉴스메일 온라인도 영상 속 마스크와 작업모를 쓴 남성이 친구와 동행한 뱅크시로 추정된다고 보도했다.뱅크시는 이번에 공개한 작품 3점에 대해 아무런 설명을 남기지 않아 작품의 의미에 대한 궁금증을 낳고 있다.뱅크시 전문가인 제임스 피크는 BBC 방송에 “뱅크시가 다음 벽화를 어디에 공개할까? 아무도 모를 것”이라며 “다만 여기 사람들 모두가 이 얘기를 하고 있다”고 말했다.일각에서는 이번 동물 벽화를 ‘런던 동물원 연작’이라고 부르면서, 최근 영국을 어수선하게 만든 극우 폭도들을 동물에 빗댄 것이라는 해석을 내놓았다.또 첫날 공개된 염소가 팔레스타인에서 자주 보이는 가축이라는 점에서 가자전쟁으로 고통받는 팔레스타인 민간인과 연대를 표시하는 것이라는 추측도 나온다.뱅크시는 이전 작품에서도 원숭이를 자주 등장시켰으며, 사회적, 정치적 의미를 전달하려 동물을 사용하곤 했다.본명이나 신원이 알려지지 않은 뱅크시는 영국은 물론이고 세계 곳곳에 메시지를 담은 벽화를 남겨 세계적으로 유명해진 화가로, 소셜미디어에 사진을 올리는 방식으로 진품을 알리곤 한다.뱅크시의 작품은 인간과 사회상에 대한 감성과 메시지를 담은 예술 작품으로 인정받았으며 전시나 경매에서 거액에 판매되기도 했다.뱅크시는 자기 작품에 대한 공식 보증과 판매를 주관하는 회사인 ‘페스트 컨트롤’을 지난 2008년 설립했다.",https://n.news.naver.com/mnews/article/025/0003378653,104,세계
"위원장·부위원장 빠진 '방송장악 청문회'…방통위 사무처 ""공영방송 이사 선임 과정 적법""",2024.08.09. 오후 3:13,"9일 오전 열린 국회 과학기술정보방송통신위원회의 '불법적 방송문화진흥회 이사 선임 등 방송장악 관련' 1차 청문회에 증인으로 출석한 방송통신위원회 직원들이 의원들이 질의하며 게시한 자료를 바라보고 있다. [Ⓒ연합뉴스][디지털데일리 강소현기자] 방송통신위원회(이하 방통위) 사무처가 공영방송 이사 선임 과정에 대해 “적법하게 추천 및 임명됐다고 생각한다”는 입장을 밝혔다.조성은 방통위 사무처장은 9일 국회 과학기술정보방송통신위원회가 진행한 '불법적 방송문화진흥회 이사선임 등 방송장악 관련 청문회'에 증인으로 참석해 ‘공영방송 이사 선임이 방통위설치법 제12조에 따라 적법하게 추천 및 임명이 이뤄졌냐’는 질의에 이같이 답했다.이번 청문회는 방통위 이진숙 위원장과 김태규 부위원장이 임명된 첫날인 지난달 31일 2인 체제에서 KBS와 MBC 대주주인 방송문화진흥회 이사 등 총 13명을 선임한 것과 관련해 적절성을 검토하기 위해 열렸다.앞서 이 위원장과 김 부위원장은 취임 당일인 지난달 31일 방문진과 KBS 이사 선임안을 의결했다. 약 1시간40분 동안 진행된 회의에서 KBS 이사회 이사 후보자 53명 중 7명을, MBC 대주주인 방송문화진흥회(방문진) 이사 후보자 31명 중 6명을 선정했다.이에 야당은 방통위가 면접 등 공영방송 이사 선임에 필요한 과정을 생략했다고 주장했다. 취임 당일 지원자의 서류를 검토할 충분한 시간이 없었을 뿐더러 면접 절차도 생략됐다는 지적이다. 이에 대해 방통위는 7~8차례 반복된 투표를 통해 후보자를 걸러냈다는 입장을 밝혔다.다만, 방통위 사무처는 이날 공영방송 이사 선임과 관련 별도 법에 규정된 절차는 없다고 말했다. 조 사무처장은 ‘공영방송 이사 선임 과정이 졸속으로 진행됐다는 주장에 대핸 어떻게 생각하시냐’는 질의에 “이사 선임과 관련해 사무처에서 이렇다 저렇다 말씀드리는 것은 적절하지 않은 것 같다”고 말을 아꼈다. 그러면서도 “(공영방송 이사 선임과 관련해) 특별한 절차가 정해져 있지 않은 것으로 안다”고 말했다.또 일부 이사가 지원서에서 자신의 이력 등을 사실과 다르게 적은 것은 향후 문제가 있다고 볼 수 있다고 봤다. 관련한 질문에 조 사무처장은 ""그 사실만을 봤을 때는 그렇게 볼 수도 있을 것 같다""고 답했다.이날 증인으로 채택된 이 위원장과 김 부위원장 등은 불참했다. 이에 과방위는 2·3차 청문회를 열기로 결정했다. 증인으로 채택되고도 연이어 출석하지 않는 경우, 국회에서의 증언·감정 등에 관한 법률(국회 증감법)에 따라 이들을 처벌할 수 있기 때문이다. 다음 청문회는 오는 14일과 21일에도 예정돼 있다.한편 최민희 과방위원장은 일부 응모자가 이 위원장에 대해 기피신청을 제기했음에도 불구, 이를 결정하는 표결에 이 위원장 스스로가 참여한 것을 문제 삼았다.조 사무처장은 '이 위원장이 표결에 참여했냐'는 최 위원장의 질의에, ""참여한 것으로 기억한다""고 답했다. 이에 최 위원장은 ""이것은 방통위법 제14조제1항 제1호를 위반했다는 점을 말씀드린다""고 했다.",https://n.news.naver.com/mnews/article/138/0002179680,105,IT/과학
