title,date,section,summary
"권익위 간부 사망 ""정권  권력 농단  피해자 계속 나와 """,2024.08.09. 오전 11:38,100,"민주당은 국회 상임위에서 권익위 국장의 사망과 김 여사 명품 가방 수수 사건 등 외압 의혹을 진상규명하기로 했습니다. 정청래 최고위원은 윤석열 정권을 비판하며 국민 앞에 진실을 밝히겠다고 강조했습니다. 또한, 국회 상임위에서 외압 의혹을 받은 권익위 국장을 윤석열 정권의 피해자로 지목하고 상임위 차원의 진상조사를 요구했습니다.민주당은 고인의 빈소를 찾아 조문할 예정이며, 외압 의혹 사건을 총괄했던 권익위 부패방지국장 직무대리의 사망으로 경찰이 수사에 착수했습니다."
"과방위 최민희 ""편파적으로 여당 편을"" 與 ""그건 아니지 않나""",2024.08.09. 오후 1:02,100,"과방위 청문회에서 여야 의원들의 호도 발언으로 소란이 빚어졌다. 최 의원은 야당의 방송법 처리에 대한 우려를 피력하며 논란을 일으켰고, 최 위원장은 의원들의 행동을 경고했다. 노 의원은 품위를 지켜야 한다고 주장하며 최 의원의 발언을 취소하도록 요구했지만, 최 의원은 호도 발언을 취소하겠다고 밝혔다.하지만 최 위원장은 계속된 갈등을 막기 위해 최 의원의 발언을 중단시켰다."
[시사정각] 김경수 복권에 술렁이는 야권...이재명 일극체제 분열될까?,2024.08.09. 오후 12:34,100,"정의당 전 의원인 박원석은 정봉주 전 의원이 이재명 전 대표의 최고위원 경선 개입에 열받고 있다고 전했습니다. 박 전 의원은 정봉주 전 의원이 이재명을 비판하는 것을 참지 못한다고 언급했습니다. 또한, 정봉주 전 의원을 수박화하고 있다는 분위기가 형성되고 있다고 소장은 전했습니다."
"셀리드, 中·日 독자적 아데노바이러스 벡터 특허 등록 결정",2024.08.09. 오후 1:57,101,"한국기업거버넌스포럼이 두산그룹의 지배구조 개편안에 대해 공개질의를 하고 있습니다. 이사회가 일반주주 관점에서 충분히 논의했는지 의문을 제기했고, 이번 분할·합병이 국민연금과 일반주주에게 피해를 줄 수 있다는 우려를 표명했습니다. 두산로보틱스는 합병 관련 증권신고서를 제출했지만 정보가 부족해 금감원에 정정을 요구받았습니다. 이복현 금감원장은 부족한 정보가 있다면 무제한으로 정정을 요구할 것이라 밝혔습니다."
"""일반주주 피해 논의했나"" 공개질의 받은 두산, 응답할까",2024.08.09. 오후 1:30,101,"셀리드는 자체 기술력으로 코로나19 백신을 개발하고 중국과 일본에서 특허 등록을 받았습니다. 이를 통해 해외 의존도를 낮추고, 다양한 신규 백신에도 적용 가능합니다. 또한, 고병원성 인플루엔자 백신과 BVAC 파이프라인에도 적용할 수 있습니다. 현재 국내 특허 및 PCT 출원을 진행 중이며, 오미크론 대응 코로나19 백신을 개발해 국가에 공급할 계획입니다."
"한화오션으로 육·해·공 갖춘 한화, 글로벌 방산 20위권 도약",2024.08.08. 오후 3:01,101,"지난 주말 가상자산 시장 폭락은 미국 경기 침체론과 일본 중앙은행의 금리인상으로 인한 엔캐리 트레이드 청산이 영향을 미쳤습니다. 미국의 경기 침체론은 '샴의 법칙'에 따라 실업률이 상승하면서 시장에 냉각작용을 일으켰고, 일본의 금리인상으로 엔캐리 트레이드 매물이 쏟아져 시장을 충격시켰습니다. 또한 VC 기업들의 이더리움 매도세도 시장 하락을 가속화시켰으며, 이에 따라 시장은 큰 변동을 겪었지만 신규실업수당 청구 건수 발표 이후 안정을 찾고 있습니다."
"대전 동구, '화재 예방' 전기차 충전시설 안전관리시스템 구축",2024.08.08. 오후 2:55,102,"정부가 서울 아파트 가격 상승에 대응하여 수도권 대규모 주택공급 방안을 발표했습니다. 그린벨트 해제로 신규 택지 조성과 재건축 재개발 활성화 등을 통해 주택 공급을 확대할 예정입니다. 서울 일부 그린벨트를 해제하여 수도권 전체적으로 8만 호를 신규택지로 조성할 계획이며, 투기 방지를 위해 거래 제한도 예정되어 있습니다. 이를 통해 6년간 42만여 가구를 신속하게 공급할 예정입니다."
김형석 새 독립기념관장 “뉴라이트 아니다”… 광복회 등 유족 “즉각 퇴진”,2024.08.09. 오전 5:02,102,독립기념관 제13대 관장으로 취임한 김형석 관장에 대한 논란이 이어지고 있습니다. 광복회와 지역 시민단체 등은 김 관장의 즉각 퇴임을 요구하며 광복절 행사 불참을 선언했습니다. 김 관장은 뉴라이트 지목에 대해 부정하며 임기 동안 성실히 근무할 것이라고 밝혔습니다.하지만 논란은 계속되고 있습니다.
전기차 포비아 확산…정부 ‘배터리 실명제’ 만지작,2024.08.09. 오후 1:40,102,"정부는 전기차 화재로 인한 불안을 해소하기 위해 배터리 제조사 정보를 공개하는 방안을 검토 중이다. 다음 달 초 발표될 종합대책에 '배터리 실명제' 도입 여부를 포함할 예정이며, 국내 차량 제조사와 안전 점검 회의를 열어 입장을 청취할 예정이다. 이에 대한 요구가 높아지고 있지만, 의견은 분분하며 정보 제공의 효과와 부작용에 대한 논의가 이어지고 있다."
"[날씨] 가마솥더위 기승, 주말에도 폭염 극심‥남부·제주 소나기",2024.08.09. 오후 12:15,103,"폭염이 계속되고 있습니다. 서울은 19일째 열대야가 이어지며, 전국이 뜨겁습니다. 아이들은 분수대에서 더위를 식히고 있습니다. 낮 최고 기온은 서울 34도, 대구 35도로 치솟을 것으로 예상됩니다. 주말에도 폭염이 이어지며, 소나기가 오는 곳도 있을 것입니다. 다음 주에도 뜨거운 날씨가 계속될 전망입니다. 오늘은 전국에 가끔 구름이 많을 것으로 보입니다."
[날씨] 오늘도 무더위 이어져…벼락·돌풍 동반 요란한 소나기,2024.08.09. 오후 1:42,103,"오늘은 전국적인 폭염이 계속되고 있습니다. 더위로 인한 불안정한 날씨로 소나기가 예상되며, 폭염특보가 발효 중입니다. 주말에도 더위가 이어지겠으니 수분을 충분히 섭취하고, 야외 활동 시 화상에 주의해야 합니다. 현재까지 폭염일수는 12.2일로 평년의 3배가 넘는 수치이며, 소나기가 강하게 쏟아질 때는 벼락과 돌풍에 주의해야 합니다."
"현대차그룹 첨단융합안전공학과, 첫번째 '첨단 인재' 받았다",2024.08.09. 오전 9:39,103,"숭실대와 현대차그룹이 첨단융합안전공학과를 개설하고 1기 입학생을 선발했습니다. 이를 통해 글로벌 첨단안전 전문인력을 양성하고 있으며, 매년 20여 명씩, 2030년까지 100여 명의 전문인력을 배출할 예정입니다. 학비는 현대차그룹이 전액 지원하며, 다양한 프로그램을 통해 학생들을 지원할 계획입니다. 또한, 첨단융합안전공학과는 현장 중심의 전문인력을 양성하여 현대차그룹의 안전을 책임질 전문가를 양성할 예정입니다."
이란 보복 예고·美 전투기 급파...중동 위기 속 가자협상 재시동,2024.08.09. 오후 1:43,104,"이란이 이스라엘에 대한 보복을 예고하며 미국은 F-22 전투기를 중동에 급파하는 등 중동의 긴장이 고조되고 있습니다. 이스라엘은 휴전협상 테이블에 참석하겠다는 입장을 내놓았고, 미국과 카타르, 이집트는 휴전과 인질 석방 협상을 촉구했습니다. 이란은 긴장 고조를 피할 출구를 찾고 있을 수도 있으며, 미국은 이란에 대한 압박을 강화하고 있습니다. 이란이 이스라엘을 공격할 경우 결과가 클 것이라고 경고했으며, 미국은 경제 제재 가능성도 검토 중입니다."
"‘거짓투성이’ 트럼프 65분 연설…“1월 6일 아무도 안 죽었다""",2024.08.09. 오후 1:50,104,"트럼프 전 대통령이 최근 연설에서 민주당과 해리스 부통령을 비판하며 자랑과 거짓을 섞어 말했습니다. 그는 해리스 부통령의 정책과 경험을 과장하고, 선거 결과에 대한 불만을 제기했습니다. 미 언론은 그의 발언을 팩트체크하며 거짓과 과장을 지적했습니다. 트럼프 전 대통령은 또한 해리스 부통령에 대한 거짓 정보를 제공하며 혼란을 야기했습니다. 이에 대한 사실 확인 결과, 그의 주장은 사실과 다른 것으로 밝혀졌습니다."
"미국·카타르·이집트 정상, 15일 휴전회담 재개 촉구",2024.08.09. 오전 10:12,104,"중동 지역에서 하마스 일인자 이스마일 하니예 암살로 긴장이 고조되는 가운데 미국과 카타르, 이집트 정상들이 이스라엘과 하마스에 휴전 회담을 재개할 것을 촉구했습니다. 이들은 휴전과 인질 석방 협상을 마무리하기 위해 노력하고 있으며, 이에 대한 기대가 높아지고 있습니다. 하마스는 아직 회담 재개에 대한 답변을 내리지 않았지만, 미국은 협상이 긍정적으로 진행될 것으로 예상하고 있습니다."
아이폰16 출시 앞둔 中 폭스콘…5만명 신규 채용,2024.08.09. 오전 10:59,105,"이란이 이스라엘에 대한 보복을 고려하고 있지만, 가자전쟁 휴전을 통해 긴장 고조를 피할 수도 있다는 관측이 나오고 있습니다. 이란은 가자지구 휴전을 대가로 이스라엘에 대한 보복을 폐기하는 방안을 숙고하고 있을 수 있습니다. 이란은 외교적 방패로 가자지구 휴전을 명분으로 이스라엘에 대한 보복을 물러나는 것이 가능할 것으로 보입니다. 이란은 이스라엘 정보기관 모사드 등 암살 책임자를 겨냥한 선별적 대응을 택할 가능성도 있습니다."
"美 '외국 대리인' 등록 신청한 존 리 우주청 본부장 ""기술·기밀정보 유출 없을 것""",2024.08.09. 오전 11:38,105,"한국계 미국인인 존 리 우주항공임무본부장이 미국 정부에 외국 대리인으로 등록을 신청했습니다. 이는 FARA 법에 따른 조치로, 외국의 영향력을 투명하게 하기 위한 것입니다. 존 리 본부장은 미 정부에 활동 내역을 보고할 예정이며, 한국의 중요 정보는 전혀 포함되지 않을 것입니다. 미 정부와의 협력을 위해 만난 인물 등은 알리게 되지만, 한국인과의 만남은 해당하지 않습니다."
“전자레인지까지 세균 득실” 방사선·고온 이기는 종류도,2024.08.09. 오전 10:56,105,"전자레인지 내부에서 발견된 박테리아는 극한 환경에서도 살아남는 것으로 확인됐습니다. 가정용 전자레인지에서 가장 많이 나오며, 실험실 전자레인지에는 유전적 다양성이 높은 박테리아가 살고 있습니다. 전자레인지는 무균이 아니지만 병원균 저장소도 아닙니다. 전자레인지를 자주 청소, 소독하여 잠재적인 병원균을 없애야 합니다. 앞으로는 극한 환경에서 살아남는 박테리아를 활용한 독성 폐기물 처리 기술을 개발할 수 있을 것으로 기대됩니다."
